,category,length,text
9,Fernsehserie nach Staat,438,"Bangkok Hilton ist eine australische Miniserie von Ken Cameron aus dem Jahr 1989.Der jungen Australierin Katrina Stanton wird von ihrem Urlaubsflirt Heroin untergeschoben. Sie wird in Bangkok im Bangkwang-Gefängnis eingesperrt, das zynisch „Bangkok Hilton“ genannt wird. Ihr Vater, ein pensionierter Jurist, der bisher in ihrem Leben nicht die geringste Rolle gespielt hat, versucht, sie mit Hilfe eines befreundeten Anwalts frei zu bekommen. Ihr droht die Todesstrafe. Der Urlaubsflirt entpuppt sich als gewerblicher Drogenhändler und ist zunächst spurlos verschwunden, so dass das Gericht der Australierin keinen Glauben schenkt. Der Vater versucht vorerst erfolglos, den Drogenhändler ausfindig zu machen, indem er seine Reiseroute nachvollzieht und zwecks Recherche sogar nach London reist. Im indischen Goa verfehlt er ihn nur um Haaresbreite.
Im Gefängnis freundet sich Katrina Stanton mit der wegen Drogenhandels zum Tod verurteilten Mandy Engels an. Durch ihre Hilfe weiß sie bald, welche Vergünstigungen durch Bestechung erreichbar sind. Mandys geistig behinderter Bruder sitzt in der Männerabteilung des Gefängnisses, weshalb sie auch weiß, wie man in die Männerabteilung kommen kann.
Mandy und ihr Bruder werden bald darauf hingerichtet. Katrina wird ebenfalls zum Tode verurteilt. Aber der Anwalt und seine Mandantin geben nicht auf. Der Vater gibt gegenüber dem Anwalt zu, vor Kriegsende 1945 selbst in dem Gefängnis als Kriegsgefangener eingesperrt gewesen zu sein und einen Ausbruchsversuch verraten zu haben. Nun kann er mit diesem Wissen seiner Tochter helfen: Sie bricht durch die Männerabteilung aus dem Gefängnis aus und kann mit Hilfe eines falschen Passes nach Australien ausfliegen.
Nachdem sich Vater und Tochter in einem Hotel in Goa auf die Lauer gelegt haben, gelingt es zu guter Letzt auch, den Drogenhändler der Polizei zu übergeben.Nicole Kidman wurde im Jahr 1989 für den Australian Film Institute Award nominiert.Mit dieser Filmrolle wurde Nicole Kidman bekannt. Ihr Vater wurde von dem damals bereits schwer kranken Denholm Elliott gespielt, für den es eine seiner letzten Rollen war.Die kanadischstämmige Hollywoodschauspielerin Deborah Kara Unger gab als Zellengenossin Astra ihr Debüt als Schauspielerin.Mittlerweile hat sich mit dem Fall Schapelle Corby ein vergleichbarer Sachverhalt tatsächlich zugetragen.Tatsächlich gab es schon früher einen ähnlichen Fall, dessen Echo in der englischen Presse mit zur Entstehung des Films beigetragen haben mag: den von Rita Nightingale, die ebenfalls in Thailand im Gefängnis saß, weil ihr ein Freund Rauschgift untergeschoben hatte. Das passierte 1977 − bevor Bangkok Hilton entstand. Allerdings kam Rita Nightingale durch eine Begnadigung frei, was damals aber auch sehr ungewöhnlich war."
10,Oper,2012,"Unter einer Arie (von italienisch aria = ‚Weise‘, ‚Luft‘; dies wiederum von lateinisch aer bzw. altgriechisch ἀήρ = ‚Luft‘) versteht man ein solistisch vorgetragenes Gesangsstück in der klassischen Musik. Eine Instrumentalbegleitung kann von der reinen Continuo-Begleitung mit nur einer Laute oder einem Cembalo, über ein kleines Ensemble mit einem oder mehreren Solo-Instrumenten bis hin zu einem großen Orchester gehen. Meistens ist eine Arie ein Teil eines größeren Werkes wie einer Oper, einer Kantate oder eines Oratoriums. Es gibt jedoch auch Einzelkompositionen, wie z. B. die Konzertarie. Die Arie vermittelt die Gefühle und Stimmungen, den sogenannten Affekt, eines bestimmten Moments, d. h. im Normalfall findet keine Handlung statt, im Gegensatz zum Rezitativ. Es können die verschiedensten Gefühle ausgedrückt werden, wie Liebe, Freude, Wut, Rache, Entrüstung, Angst, Zweifel usw. In der barocken Oper entstanden schon im 17. Jahrhundert je nach Inhalt außerdem bestimmte Typen, wie die Sturmarie – im Text oft mit Vergleichen wie einem stürmischen Meer oder einem sinkenden Schiff -, die Beschwörungsarie, Verführungsarie, Schlummerarie, Abschiedsarie, Toilettenarie – letztere wurde von einer Frau gesungen, die sich vor ihrem Spiegel schön macht und schmückt. Sehr beliebt waren auch Arien, die den Gesang der Vögel imitieren.Im Vergleich zum Sprechgesang des Rezitativs wird die Stimme in einer Arie rein lyrisch und melodisch behandelt (melismatisch), und besonders in der Ära des Belcanto auch oft kunstvoll und verziert. Auch die Begleitung kann melodisch und reich ausgeschmückt sein. In einer Arie sind oft Wiederholungen in Text und Melodie enthalten. Ist ein Stück weniger umfangreich, der Affekt gemäßigter, so spricht man auch von einer Ariette, einer „kleinen Arie“. Es gibt verschiedene Arienformen, unter anderem die Dacapo-Arie, die Cavatine und die Cabaletta. Eine Bravourarie rsp. Bravour-Arie ist eine schwierige, auf virtuose Wirkung abzielende Arie. Die erste Arie einer Opernfigur nennt man Auftrittsarie. Zum Szenenschluss gibt es außerdem die sogenannte Abgangsarie. In einer Opera seria im 18. Jahrhundert standen einer Primadonna oder einem primo uomo (normalerweise ein Kastrat) mindestens fünf Arien zu – jede Arie von einem anderen Affekt oder Charakter –, der seconda donna und dem secondo uomo drei Arien, kleinere Nebenrollen bekamen nur ein oder zwei, oder gar keine Arie.Im Gegensatz zur affektbetonten Arie steht das Rezitativ, das die Handlung vorantreiben soll. Es enthält normalerweise keine Wiederholungen, und seine Begleitung ist einfacher als die einer Arie. Vor allem jedoch ist für das Rezitativ ein Sprechgesang typisch, der im Gegensatz zu dem Lyrismus einer Arie steht. Innerhalb eines Rezitativs können kurze melodiösere, arienartige Abschnitte begegnen, diese nennt man Arioso. Sehr oft ist einer Arie ein Rezitativ vorangestellt, das inhaltlich bereits die Arie vorbereitet, also die Abfolge: Rezitativ – Arie. Das gilt besonders innerhalb von Oper, Oratorium und Kantate, aber auch bei Konzertarien. Eine Arie unterscheidet sich von Gesangsstücken für mehrere Gesangsstimmen, die je nach Anzahl der beteiligten Stimmen Duett, Terzett, Quartett etc. genannt werden. In einer Oper gibt es auch Stücke mit noch mehreren Gesangspartien, z. T. sogar mit Chor, der übergeordnete Begriff dafür lautet: Ensemble. Im Gegensatz zur Arie ist das Lied sowohl formal, und besonders gesanglich (bzw. gesangstechnisch) normalerweise einfacher gehalten. Die Grenzen sind jedoch fließend. So können die Anforderungen vor allem an eine expressive Gestaltung beim sogenannten Kunstlied beachtlich sein; dieses ist jedoch inhaltlich und in der Besetzung normalerweise intim gehalten.Eine frühe Form der Aria, die schon Giulio Caccini (Le nuove musiche, 1601 und 1614) und andere Komponisten um 1600 und in der ersten Hälfte des 17. Jahrhunderts verwendeten, hatte eine Strophenform, d. h. die ganze, meist eher kurze Aria wurde mindestens einmal wiederholt, je nach Zahl der Strophen. Der Charakter solcher Arien ist meistens leichtfüßig, und sie sind oft in Dreiermetren gehalten, die Begleitung im Frühbarock bestand oft nur aus dem Continuo. Diese Arien konnten auch von vornherein virtuos sein und Koloraturen enthalten. Rein theoretisch wäre außerdem eine jeweils andere Auszierung und / oder Darstellung durch den Sänger bzw. die Sängerin bei jeder Wiederholung denkbar (eventuell durch den jeweils unterschiedlichen Text motiviert). Die Arie in Strophenform wurde auch später noch verwendet, beispielsweise Papagenos Arie „Der Vogelfänger bin ich ja“ aus Mozarts Zauberflöte (1791). Eine zweiteilige Arien-Form ||: a :||: b :|| steht formal in einem engen Verhältnis zur zeitgenössischen barocken Tanzmusik. Dies war die normale und meistverwendete Arienform der französischen Barockoper (Lully, Campra, Rameau u. a.). Charakterlich konnten solche Arien einem ganz konkreten Tanz entsprechen, z. B. einem Menuett, einer Gavotte, einer Loure etc. Diese Art der zweiteiligen Arien wurden aber auch in italienischer oder italienisch beeinflusster Musik verwendet, beispielsweise von Händel (besonders in frühen Opern wie Agrippina (1709) oder später in Serse (1738)) oder von Reinhard Keiser. In der italienischen und deutschen Oper konnten die Reprisen (Wiederholungen) vom Sänger ausgeziert werden; in der französischen Oper waren zusätzliche willkürliche Verzierungen jedoch nicht üblich. Im frühen Barock bis ca. 1680/1700 waren auch Ostinato-Arien sehr beliebt, oft als Lamento. Beispiele gibt es besonders in den Opern Francesco Cavallis oder in Henry Purcells Dido and Aeneas (1689). Eine beherrschende Stellung in der Barockmusik erlangte die Da-capo-Arie in der Form A-B-A. Dabei bilden die beiden Teile A und B oft (aber nicht immer) einen deutlichen Kontrast, z. B. steht der B-Teil meistens und mindestens in einer anderen Tonart, oder er moduliert durch und in andere Tonarten. Im Extremfall hat er sogar einen ganz anderen Affekt, und kann dann nicht nur in einem anderen Tempo, sondern auch in einem anderen Metrum stehen (z. B. „Ah mio cor, schernito sei“ in Händels Alcina (1735)). Ein wichtiger Sinn der Dacapo-Arie ist, dass die Wiederholung des A-Teils vom Sänger nach Möglichkeit mit willkürlichen Manieren ausgeziert werden sollte, also mit zusätzlichen Läufen, Umspielungen, auch Trillern u. a. Allerdings wurde auch der originale A- und der B-Teil mit Trillern verziert, vor allem bei Kadenzen – dies war völlig selbstverständlich, und wurde deshalb auch normalerweise gar nicht notiert, im Gegensatz zur französischen Musik, wo man alle Triller und Mordente aufschrieb. Die Dacapo-Arie war also eine bedeutende Möglichkeit, die eigene Fantasie und sogar kompositorische Fähigkeiten zu demonstrieren, und natürlich die eigenen stimmlichen und technischen Fähigkeiten des Sängers ins rechte Licht zu rücken. Zur Freude des Publikums.Die erste Da-Capo-Arie taucht zuerst in Monteverdis L’Orfeo (1607) auf. Im 17. und 18. Jahrhundert wird die Form weiter ausgebaut. Nicht selten enthalten große Da-capo-Arien auch rein instrumentale Ritornelle. Zur höchsten Blüte kam die Da-capo-Arie am Höhepunkt der Neapolitanischen Opernschule. Während die alte einfache Strophenliedform der Arie der Charakterisierung volkstümlicher Partien (in der Opera buffa) vorbehalten blieb, war die Dacapo-Arie ein typischer Bestandteil des aristokratischen oder mythologischen Personals der Opera seria. Die Dacapo-Arienform wurde ab ca. 1750 häufig leicht abgewandelt, dabei wurde der A-Teil oft etwas verkürzt (Dal segno), beispielsweise konnte eine lange Orchestereinleitung wegfallen (z. B. in frühen Mozart-Opern wie Mitridate (1770) oder Lucio Silla (1772)). Zu den Komponisten, welche Dacapo-Arien schrieben, gehören: Alessandro Scarlatti und andere Vertreter der Neapolitanischen Oper, Antonio Caldara, Antonio Vivaldi, Giovanni Battista Bononcini, Nicola Antonio Porpora, Georg Friedrich Händel, Johann Sebastian Bach, Georg Philipp Telemann, Johann Adolph Hasse, Baldassare Galuppi, Christoph Willibald Gluck, Wolfgang Amadeus Mozart u. v. a. Im Spätbarock bis ca. 1800 kam auch das Rondo (A-B-A-C-A) auf, in der klassischen Oper meistens als Rondò finale. Das letztere war ausschließlich dem Primo uomo oder der Primadonna vorbehalten, und wurde erst gegen Ende gesungen. Beispiele sind in Mozarts La clemenza di Tito (1791) die Arien „Deh, per questi istante solo“ für den primo uomo Sesto und „Non più di fiori“ für die prima donna Vitellia. Auch hier bieten rein theoretisch alle Wiederholungen des A-Teils dem Sänger oder der Sängerin die Möglichkeit für Ausschmückungen mit eigenen improvisierten Ornamenten, die im Idealfall bei jeder Wiederholung zum Ende hin üppiger werden können, im Sinne einer Steigerung – allerdings muss dabei natürlich der Ausdruck (affetto) und Tonfall der Arie beachtet werden. Nach 1750 kam auch eine zweiteilige Arien-Form A-B (oder A-A'-B) auf, die bereits auf die typische Arienform in der Belcanto-Oper des 19. Jahrhunderts hinwies. Diese Arienform war im Gegensatz zum statischen oder quasi-Konzert-Charakter der Dacapo-Arie dynamischer, und konnte von Komponisten wie Mozart oder Salieri auch dramaturgisch nutzbar gemacht werden. Die beidenTeile gehen oft ineinander über, davon ist der erste normalerweise langsam oder mäßig und meditativ, der zweite schnell und tendenziell virtuos. Ein typisches Beispiel hierfür ist z. B. Mozarts Konzert- bzw. Einlage-Arie „Vorrei spiegarvi, o Dio“, KV 418 (1783), oder auch die erste Arie der Königin der Nacht „O zittre nicht, mein lieber Sohn“ in der Zauberflöte. Diese Arienform wurde in der italienischen Belcanto-Oper des 19. Jahrhunderts noch ausgebaut, und besteht dort grundsätzlich aus einer ersten Aria oder Cavatine in einem lyrischen Moderato- oder Largo-Tempo, und einer abschließenden meist virtuosen Cabaletta; sowohl die Aria als auch die Cabaletta wurden oft wiederholt, und auch fürs 19. Jahrhundert ist bekannt, dass Wiederholungen in Arien grundsätzlich von Sängerin oder Sänger ausgeziert wurden. Zwischen diesen beiden Teilen gibt es oft einen mehr oder weniger langen und manchmal musikalisch gewichtigen Übergangsteil in der Mitte, wodurch das Ganze noch dynamischer und stärker in die Handlung eingebunden wird. Beispiele finden sich in jeder Oper von Komponisten wie Rossini, Bellini, Donizetti, dem frühen Verdi u. a., genannt sei hier die Auftrittsarie der Lucia „Regnava nel silenzio (= cavatina) … Quando rapita in estasi (= cabaletta)“ aus Donizettis Lucia di Lammermoor (1837). Die gleiche Form haben grundsätzlich auch Duette und andere Ensembles, und es kamen auch häufig Arien mit Einwürfen anderer Solisten und/oder des Chores vor, wie z. B. in Bellinis berühmter Arie „Casta Diva (= cavatina)... Ah, bello, a me ritorna (= cabaletta)“ aus Norma (1831). Rossini, Mercadante u. a. verwendeten auch manchmal eine erweiterte Variationsform als Arie, z. B. „D' Amor al dolce impero“ in Rossinis Armida (1817), die ebenfalls Ritornelle und eine Coda für Chor hat. Solche Variationsformen dienten besonders der Zurschaustellung sängerischer Bravour. Im späten 18. Jahrhundert, sowohl in der komischen Oper, und auch nach der so genannten Opernreform durch Christoph Willibald Gluck, der damit die von anderen formalen Schemata geprägte Tradition der französischen Oper weitergab, näherte sich die Arie wieder mehr der Liedform an. Besonders in Deutschland im 19. Jahrhundert wurde die Arie dabei zunehmend stark vom Volkslied beeinflusst (z. B. Webers Freischütz (1821)). In der spätromantischen und veristischen Oper ging die Arie immer mehr in der Szene oder Scena auf. "
11,Oper,466,"Dein ist mein ganzes Herz ist eine Arie aus dem 2. Akt der 1929 uraufgeführten Operette „Das Land des Lächelns“  von Fritz Löhner-Beda und Ludwig Herzer mit Musik von Franz Lehár.Das Lied steht in Des-Dur und ist nach dem Schema Einleitung-Refrain-Strophe-Refrain aufgebaut. Das dreitaktige, mit einem  verminderten Septakkord in Fortissimo einsetzende Vorspiel erzeugt sofort eine dramatische Stimmung. Die im Vier-Viertel-Takt gehaltene Titelmelodie („Allegretto moderato ma non troppo“) geht im 16. Takt durch zwei überleitende Takte mit dem 2. Thema in die Strophe über, die im Sechs-Achtel-Takt („Etwas bewegter“) gehalten ist und durch charakteristische Läufe aus Sechzehntelnoten begleitet wird. Danach wird die Titelmelodie wiederholt und endet schneller werdend („Allegro“) mit dem über vier Takte gehaltenen Schlusston im dreifachen Fortissimo.Teile des Liedes schrieb Lehár bereits in der 1923 unter dem Namen „Die gelbe Jacke“ uraufgeführten Erstfassung der Operette für die Person des chinesischen Prinzen Sou-Chong. Fritz Löhner-Beda verlegte daraus die Passage Duft strömt aus deinem Haar und deine Haut ist wie Parfüm… aus dem ersten in den zweiten Akt und textete stattdessen Dein ist mein ganzes Herz, wo du nicht bist, kann ich nicht sein…. Die Melodie dafür fand er in einem 16-taktigen Arioso auf Seite 120 der 124 Seiten langen Klavierpartitur, das dem Gedächtnis des Komponisten bereits entfallen war.
Das Lied wurde dem Tenor Richard Tauber gewidmet, der es uraufführte, aber auch immer wieder als Zugabe sang und so zu großer Popularität brachte. Nach der 1938 erfolgten Emigration Taubers nach London wurde das Lied auch im englischen Sprachraum sowohl mit dem deutschen Text als auch in der englischen Übersetzung („You are my heart's delight“) ein Weltschlager. Es galt als „das Tauberlied“.
Am 10. Dezember 2012 wurde das Lied in Oslo von Tenor Brenden Gunnell zum Abschluss der Feier zur Verleihung des Friedensnobelpreises an die Europäische Union gesungen.Weitere Interpreten des Liedes waren unter anderem: Joseph Schmidt, Fritz Wunderlich, Jussi Björling, Mario Lanza, Sergio Franchi im Duett mit Anna Moffo, Plácido Domingo, José Carreras, Luciano Pavarotti, Jonas Kaufmann, Anna Netrebko, Rolando Villazón, Stuart Burrows und Rudolf Schock. Modernisierte Adaptionen gibt es u. a. von Oscar Peterson, James Last, Frank Sinatra, Manfred Krug und Max Raabe.1985 veröffentlichte Heinz Rudolf Kunze seinen bislang erfolgreichsten Song Dein ist mein ganzes Herz vom gleichnamigen Album. Darin zitiert er nicht nur den Titel der Arie, sondern auch die Zeile Wo du nicht bist, kann ich nicht sein.Aufnahme von 2006 mit Anna Netrebko, Plácido Domingo, Rolando Villazón und den Berliner Philharmonikern"
12,Oper,132,"La donna è mobile [la ˈdɔnna ɛ ˈmɔːbile] („Die Frau ist launisch“ oder „O wie so trügerisch sind Weiberherzen“) ist die Kanzone des Herzogs von Mantua aus dem dritten Akt von Giuseppe Verdis Oper Rigoletto aus dem Jahr 1851.
Der Text geht auf einen Ausspruch Franz I. zurück: „Souvent femme varie. Bien fol est qui s’y fie!“ (Oft ist die Frau trügerisch. Ein Narr, wer ihr vertraut!), den Victor Hugo wörtlich in sein Stück Le roi s’amuse, die Vorlage zu Rigoletto, übernommen hatte.Die deutsche Übersetzung stammt von Johann Christoph Grünbaum, die deutschsprachige Premiere war am 30. Januar 1853 in Stuttgart.

== Einzelnachweise =="
13,Oper,102,"E lucevan le stelle (italienisch für: ""Und es leuchteten die Sterne"") ist eine Arie in Giacomo Puccinis Oper Tosca, die am 14. Januar 1900 im Teatro Costanzi in Rom uraufgeführt wurde.
Das Stück gilt als eine der bekanntesten und beliebtesten Opernarien. Sie wurde in h-Moll verfasst, das Libretto stammt von Giuseppe Giacosa und Luigi Illica. Sie wird im 3. Akt der Oper von Toscas Geliebtem, dem Maler Mario Cavaradossi (Tenor), gesungen, als dieser kurz vor seiner Hinrichtung einen letzten Abschiedsbrief an Tosca schreiben darf."
14,Oper,296,"Habanera, oder L'amour est un oiseau rebelle (dt. Die Liebe ist ein wilder Vogel), ist der Name einer bekannten Arie aus Carmen, einer Oper von Georges Bizet. Die Oper wurde am 3. März 1875 in der Opéra-Comique in Paris uraufgeführt, das Libretto der Oper stammt von Henri Meilhac und Ludovic Halévy, wobei der Text der Arie von Bizet selbst verfasst wurde. Die Habanera-Arie basiert auf El Arreglito von Sebastián de Yradier und erfreut sich auch außerhalb der Opern-Welt großer Beliebtheit. Die Arie wird im I. Akt von der Titelfigur, der Zigeunerin Carmen (Mezzosopran), gesungen, sie bringt darin ihre Gleichgültigkeit gegenüber den Liebesbeteuerungen und Annäherungsversuchen ihrer zahlreichen Verehrer zum Ausdruck.Carmens Habanera ist für eine Mezzosopranstimme geschrieben. Die ersten 19, beziehungsweise 16, Takte mit der markanten chromatisch absteigenden Melodielinie der beiden Strophen erklingen in d-Moll, die folgenden in D-Dur. Das Taktmaß sind langsame 2⁄4. Bizet gibt die Tempobezeichnung Allegretto quasi Andantino vor und als Wert für das Metronom  = 72 an. Die Viertelnote soll also mit 72 Schlägen pro Minute gespielt werden. Die Arie dauert mit ihren 120 Takten je nach Interpretation daher zwischen dreieinhalb und viereinhalb Minuten. Die musikalische Tonstärke beginnt zunächst mit einem äußerst leisen  (pianissimo) und steigert sich am Ende zu einem triumphierenden  (fortissimo) im Schlussakkord.Georges Bizet verwandte die Melodie der Habanera auch konzertant in seiner zweiten Carmen-Suite für Orchester. Darüber hinaus wurde das Stück von vielen Künstlern adaptiert, bearbeitet und transkribiert, so auch von Friedrich Hollaender, der 1931 in seinem satirischen Couplet An allem sind die Juden schuld für die Berliner Kabarettistin Annemarie Hase die Melodie der Habanera nutzt."
15,Oper,530,"Der Hölle Rache kocht in meinem Herzen ist die zweite Arie der Königin der Nacht in Wolfgang Amadeus Mozarts Oper Die Zauberflöte.Der Hölle Rache kocht in meinem Herzen, gewöhnlich abgekürzt als Der Hölle Rache, wird oft als die „Rachearie“ oder „Arie der Königin der Nacht“ bezeichnet, obwohl die Rolle schon im ersten Akt mit der Arie: O zittre nicht, mein lieber Sohn auftritt, die im abschließenden Teil zahlreiche Koloraturen enthält.
Die Arie ist Teil des 2. Akts der Zauberflöte. Von Rachsucht getrieben, gibt die Königin der Nacht ihrer Tochter Pamina ein Messer und trägt ihr auf, ihren Rivalen Sarastro zu ermorden. Andernfalls verstoße und verlasse sie ihre Tochter Pamina. („Fühlt nicht durch dich Sarastro Todesschmerzen, so bist du meine Tochter nimmermehr.“)Die Arie ist in d-Moll geschrieben und für 2 Flöten, 2 Oboen, 2 Fagotte, 2 Hörner in F, 2 Clarini (Trompeten) in D, Pauken und Streicher instrumentiert. Die Tonart d-Moll hat bei Mozart oftmals dramatisch hochgeladene, düster-schicksalsschwere Bedeutung, wie beispielsweise in der Ouvertüre zu Don Giovanni, im Klavierkonzert KV 466 oder schließlich im Requiem KV 626. Die Orchesterbegleitung fällt hier größer aus als bei O zittre nicht; bis auf die Klarinetten und Posaunen ist das ganze Orchester beteiligt.
Der Hölle Rache ist als besonders anspruchsvolles Stück bekannt. Der Tonumfang geht über zwei Oktaven, vom f1 bis zum f3. Die Arie erfordert für die Sopransolistin eine besonders hohe Tessitur.Das Libretto wurde von Emanuel Schikaneder geschrieben, der in der Uraufführung auch den Papageno spielte.

Der Text beginnt mit einem Vierzeiler im jambischen Fünfheber – ungewöhnlich für die Zauberflöte, die zum Großteil aus jambischen Tetrametern besteht. Darauf folgen vier Verse im jambischen Dreiheber, das abschließende Couplet besteht wiederum aus Fünfhebern. Das Reimschema ist [ababcccded].Die erste Sängerin, die die Arie auf der Bühne sang, war Mozarts Schwägerin Josepha Hofer, die zu diesem Zeitpunkt 33 Jahre alt war. Es heißt, dass Hofer eine besonders bewegliche Stimme mit einem ausgeprägten hohen Register hatte. Um das zu zeigen, schrieb Mozart ihr die beiden Arien der Königin der Nacht „auf den Leib“.
In einem Brief aus dem Jahr 1840 schrieb der Komponist Ignaz von Seyfried:

„Am Abend des 4. Dezember lag Mozart schon in Fantasien und wähnte im Wiednertheater der Zauberflöte beyzuwohnen; fast die letzten, seiner Frau zugeflüsterten Worte waren: ‚Still! still! jetzt nimmt die Hofer das hohe F; – jetzt singt die Schwägerin ihre zweyte Arie: »Der Hölle Rache«; wie kräftig sie das B anschlagt und aushält: »Hört! hört! hört! der Mutter Schwur!«“Die Arie, gesungen von Edda Moser, gehört zu den ausgewählten Musikstücken, die als Beispiele für die Musik der Menschheit auf Voyager Golden Records aufgenommen wurden. Diese Datenplatten verließen an Bord der Raumsonden Voyager 1 und Voyager 2 das Sonnensystem."
